{
  "$schema": "../../schemas/addon-store.schema.json",
  "id": "my-addon",
  "name": "My Addon",
  "description": "One sentence explaining what the addon does.",
  "author": {
    "name": "GitHub username or author name",
    "url": "https://github.com/username"
  },
  "trust": "community",
  "verification": "unverified",
  "status": "active",
  "tags": ["planning"],
  "repository": "https://github.com/username/my-addon"
}
