{
  "$schema": "../../../schemas/addon-store.schema.json",
  "id": "value-averaging-addon",
  "name": "Value Averaging Addon",
  "description": "Runs a value averaging strategy with portfolio weights, top-up rules, growth schedules, and per-ticker investment amounts.",
  "author": {
    "name": "wujoe",
    "url": "https://github.com/WuJoe826"
  },
  "trust": "community",
  "verification": "unverified",
  "status": "active",
  "tags": ["planning", "strategy"],
  "repository": "https://github.com/WuJoe826/Value-Averaging-Addon"
}
