{
  "$schema": "../../schemas/addon-store.schema.json",
  "id": "my-verified-addon",
  "name": "My Verified Addon",
  "description": "One sentence explaining what the addon does.",
  "author": {
    "name": "GitHub username or author name",
    "url": "https://github.com/username"
  },
  "trust": "community",
  "verification": "verified",
  "status": "active",
  "tags": ["analytics"],
  "repository": "https://github.com/username/my-verified-addon",
  "supportUrl": "https://github.com/username/my-verified-addon/issues",
  "source": {
    "repository": "https://github.com/username/my-verified-addon",
    "tag": "v1.0.0",
    "commit": "0000000000000000000000000000000000000000"
  },
  "release": {
    "version": "1.0.0",
    "minWealthfolioVersion": "3.6.0",
    "sdkVersion": "3.5.1",
    "critical": false,
    "breaking": false,
    "notes": "Initial verified community release.",
    "changelogUrl": "https://github.com/username/my-verified-addon/releases/tag/v1.0.0"
  },
  "distribution": {
    "r2Path": "my-verified-addon/1.0.0/my-verified-addon.zip",
    "sha256": "0000000000000000000000000000000000000000000000000000000000000000"
  },
  "media": {
    "coverLight": "assets/cover-light.webp",
    "coverDark": "assets/cover-dark.webp"
  }
}
